{
  "schema_version": 1,
  "name": "rfdetr-single-view-managed-smoke",
  "project": {"path": "/srv/research/rf-detr"},
  "runtime": {
    "workdir": "/srv/research/rf-detr",
    "environment_variables": {
      "PYTHONDONTWRITEBYTECODE": "1",
      "PYTHONPATH": "/home/ubuntu/.ml-orchestrator/app/src",
      "PATH": "/home/ubuntu/anaconda3/envs/RFDETR/bin:/usr/local/bin:/usr/bin:/bin",
      "HF_HUB_OFFLINE": "1",
      "WANDB_MODE": "disabled",
      "CUBLAS_WORKSPACE_CONFIG": ":4096:8",
      "PYTORCH_CUDA_ALLOC_CONF": "expandable_segments:True"
    }
  },
  "command": {
    "argv": [
      "/home/ubuntu/anaconda3/envs/RFDETR/bin/python", "-u",
      "/home/ubuntu/.ml-orchestrator/app/examples/rfdetr_managed.py",
      "--epochs", "1", "--batch-size", "1", "--grad-accum", "1",
      "--num-workers", "0", "--fast-dev-run"
    ]
  },
  "resources": {"gpu_index": 0, "max_duration_seconds": 900, "max_queue_seconds": 60},
  "outputs": {"checkpoint_glob": "orchestrator_runs/${RUN_ID}/checkpoints/*.ckpt"},
  "automation": {"max_attempts": 1, "allowed_actions": ["wait", "complete"]},
  "task": {"kind": "train", "inputs": []}
}
